{
  "request_id": "adc548cead01",
  "brief": {
    "schema": "japanese-rap-brief/v2",
    "run_id": "rap-demo-anime-satire-001",
    "mode": "create",
    "deliverable": "verse",
    "language": "ja",
    "theme": "アニメと、それを消費する社会への皮肉",
    "core_message": "アニメを『経済効果』と呼んで持ち上げる社会が、作り手を安く磨り減らし、観る側も倍速で夢を消費している。その矛盾を、アニメを愛する観察者が淡々と撃ち抜く。",
    "facts_and_images": [
      "ワンクールごとに入れ替わる深夜アニメの新作ラッシュ",
      "サブスク配信と倍速視聴、切り抜きでのトレンド消費",
      "アニメーターの低賃金・長時間労働は広く報道されている事実",
      "『クールジャパン』という官製ブランディング",
      "かつて『オタク』と嘲笑した層が、今は経済効果と呼んで持ち上げる手のひら返し",
      "聖地巡礼、円盤、ガチャ課金といった消費の風景",
      "作画枚数・原画・動画といった手作業の積み重ねで1秒が作られる"
    ],
    "fiction_or_lived": "fictional",
    "speaker": {
      "identity": "アニメに救われてきた一視聴者。業界人ではない観察者で、冷静な皮肉屋",
      "fictional": true,
      "point_of_view": "first",
      "knowledge_boundary": [
        "業界内部の当事者経験はない(報道・公開情報レベルの知識のみ)",
        "特定の実在作品名・実在人物名を断定的に扱わない"
      ]
    },
    "listener": "アニメを消費だけして作り手を見ない社会全体",
    "setting": {
      "time": "深夜、配信の新作が更新される頃",
      "place": "画面の光だけが点く部屋"
    },
    "tone": [
      "cool",
      "deadpan",
      "ironic"
    ],
    "register": "conversational",
    "dialect": {
      "name": "none",
      "confidence": "high"
    },
    "bpm": null,
    "meter": "4/4",
    "bars": 8,
    "structure": [
      {
        "section_id": "S1",
        "bars": "1-8",
        "function": "verse"
      }
    ],
    "rhyme_density": "medium",
    "rhyme_methods": [
      "assonance",
      "slant",
      "internal",
      "end"
    ],
    "humor_intensity": "medium",
    "explicitness": "clean",
    "required_words": [],
    "forbidden_words": [],
    "reference_traits": [],
    "generation_target": "none",
    "copyright_input_class": "original_prompt",
    "assumptions": [
      "BPM未指定のため、ミッドテンポ(85〜95想定)のブーンバップ系を仮定。flowは text_only 提案に留める",
      "8小節お試しのため、フックなしのワンバース構成",
      "皮肉はユーモアというより satire/deadpan 機構で運用し、笑いより切れ味を優先",
      "実在の作品名・企業名は使わない(一般名詞と制度名のみ)"
    ],
    "unknowns": [
      "実演時のBPM・ビート",
      "パフォーマンス時のアクセント・ポケット(音源なしのため unverified)"
    ]
  },
  "generation_brief": {
    "schema": "japanese-rap-brief/v2",
    "run_id": "rap-demo-anime-satire-001",
    "mode": "create",
    "deliverable": "verse",
    "language": "ja",
    "theme": "アニメと、それを消費する社会への皮肉",
    "core_message": "アニメを『経済効果』と呼んで持ち上げる社会が、作り手を安く磨り減らし、観る側も倍速で夢を消費している。その矛盾を、アニメを愛する観察者が淡々と撃ち抜く。",
    "facts_and_images": [
      "ワンクールごとに入れ替わる深夜アニメの新作ラッシュ",
      "サブスク配信と倍速視聴、切り抜きでのトレンド消費",
      "アニメーターの低賃金・長時間労働は広く報道されている事実",
      "『クールジャパン』という官製ブランディング",
      "かつて『オタク』と嘲笑した層が、今は経済効果と呼んで持ち上げる手のひら返し",
      "聖地巡礼、円盤、ガチャ課金といった消費の風景",
      "作画枚数・原画・動画といった手作業の積み重ねで1秒が作られる"
    ],
    "fiction_or_lived": "fictional",
    "speaker": {
      "identity": "アニメに救われてきた一視聴者。業界人ではない観察者で、冷静な皮肉屋",
      "fictional": true,
      "point_of_view": "first",
      "knowledge_boundary": [
        "業界内部の当事者経験はない(報道・公開情報レベルの知識のみ)",
        "特定の実在作品名・実在人物名を断定的に扱わない"
      ]
    },
    "listener": "アニメを消費だけして作り手を見ない社会全体",
    "setting": {
      "time": "深夜、配信の新作が更新される頃",
      "place": "画面の光だけが点く部屋"
    },
    "tone": [
      "cool",
      "deadpan",
      "ironic"
    ],
    "register": "conversational",
    "dialect": {
      "name": "none",
      "confidence": "high"
    },
    "bpm": null,
    "meter": "4/4",
    "bars": 8,
    "structure": [
      {
        "section_id": "S1",
        "bars": "1-8",
        "function": "verse"
      }
    ],
    "rhyme_density": "medium",
    "rhyme_methods": [
      "assonance",
      "slant",
      "internal",
      "end"
    ],
    "humor_intensity": "medium",
    "explicitness": "clean",
    "required_words": [],
    "forbidden_words": [],
    "reference_traits": [],
    "generation_target": "none",
    "copyright_input_class": "original_prompt",
    "assumptions": [
      "BPM未指定のため、ミッドテンポ(85〜95想定)のブーンバップ系を仮定。flowは text_only 提案に留める",
      "8小節お試しのため、フックなしのワンバース構成",
      "皮肉はユーモアというより satire/deadpan 機構で運用し、笑いより切れ味を優先",
      "実在の作品名・企業名は使わない(一般名詞と制度名のみ)"
    ],
    "unknowns": [
      "実演時のBPM・ビート",
      "パフォーマンス時のアクセント・ポケット(音源なしのため unverified)"
    ]
  },
  "reference_brief": null,
  "tasks": [
    {
      "id": "narrative",
      "role": "narrative_architect",
      "depends_on": [],
      "artifact": "narrative_map.json",
      "input_brief": "generation_brief",
      "allowed_references": [],
      "write_scope": [
        "narrative_map.json"
      ],
      "status": "pending",
      "contract": [
        "return proposition, pressure, turn, residue, bar functions, and setup/payoff ids"
      ]
    },
    {
      "id": "vocabulary",
      "role": "vocabulary_director",
      "depends_on": [],
      "artifact": "vocabulary_bank.json",
      "input_brief": "generation_brief",
      "allowed_references": [],
      "write_scope": [
        "vocabulary_bank.json"
      ],
      "status": "pending",
      "contract": [
        "return concrete objects/actions before abstractions",
        "annotate meaning, register, semantic domain, and likely syntax affordances"
      ]
    },
    {
      "id": "humor",
      "role": "humor_engineer",
      "depends_on": [],
      "artifact": "humor_plan.json",
      "input_brief": "generation_brief",
      "allowed_references": [],
      "write_scope": [
        "humor_plan.json"
      ],
      "status": "pending",
      "contract": [
        "return mechanism, setup, violated expectation, target, payoff, and timing",
        "reject punch-down and reference-only jokes"
      ]
    },
    {
      "id": "rhyme",
      "role": "rhyme_graph_engineer",
      "depends_on": [],
      "artifact": "rhyme_graph.json",
      "input_brief": "generation_brief",
      "allowed_references": [],
      "write_scope": [
        "rhyme_graph.json"
      ],
      "status": "pending",
      "contract": [
        "return readings, morae, rhyme relations, placements, confidence, and penalties",
        "do not equate sound similarity with lyric quality"
      ]
    },
    {
      "id": "flow",
      "role": "flow_mapper",
      "depends_on": [],
      "artifact": "flow_map.json",
      "input_brief": "generation_brief",
      "allowed_references": [],
      "write_scope": [
        "flow_map.json"
      ],
      "status": "pending",
      "contract": [
        "return density, subdivision, accents, rests, held vowels, breath, voice, and switches",
        "mark pocket unverified without audio"
      ]
    },
    {
      "id": "vocabulary_rhyme_reconcile",
      "role": "specialist_reconciler",
      "depends_on": [
        "vocabulary",
        "rhyme"
      ],
      "artifact": "vocabulary_rhyme_reconciliation.json",
      "input_brief": "generation_brief",
      "allowed_references": [],
      "write_scope": [
        "vocabulary_rhyme_reconciliation.json"
      ],
      "status": "pending",
      "contract": [
        "resolve cross-artifact ids, readings, bar ranges, setup/payoff links, and rejected options",
        "do not write finished lyrics"
      ]
    },
    {
      "id": "narrative_humor_reconcile",
      "role": "specialist_reconciler",
      "depends_on": [
        "narrative",
        "vocabulary",
        "humor"
      ],
      "artifact": "narrative_humor_reconciliation.json",
      "input_brief": "generation_brief",
      "allowed_references": [],
      "write_scope": [
        "narrative_humor_reconciliation.json"
      ],
      "status": "pending",
      "contract": [
        "resolve cross-artifact ids, readings, bar ranges, setup/payoff links, and rejected options",
        "do not write finished lyrics"
      ]
    },
    {
      "id": "rhyme_flow_reconcile",
      "role": "rhyme_flow_reconciler",
      "depends_on": [
        "narrative",
        "vocabulary",
        "rhyme",
        "flow"
      ],
      "artifact": "rhyme_flow_reconciliation.json",
      "input_brief": "generation_brief",
      "allowed_references": [],
      "write_scope": [
        "rhyme_flow_reconciliation.json"
      ],
      "status": "pending",
      "contract": [
        "resolve first-pass rhyme and flow conflicts without changing the brief",
        "return accepted placements, rejected candidates, and draft-time remap requirements"
      ]
    },
    {
      "id": "draft",
      "role": "draft_integrator",
      "depends_on": [
        "narrative",
        "vocabulary",
        "humor",
        "rhyme",
        "flow",
        "vocabulary_rhyme_reconcile",
        "narrative_humor_reconcile",
        "rhyme_flow_reconcile"
      ],
      "artifact": "draft.json",
      "input_brief": "generation_brief",
      "allowed_references": [],
      "write_scope": [
        "draft.json"
      ],
      "status": "pending",
      "contract": [
        "use accepted artifacts; preserve meaning before maximizing rhyme density",
        "return clean draft plus traceability to artifact ids"
      ]
    },
    {
      "id": "flow_remap",
      "role": "flow_mapper",
      "depends_on": [
        "draft"
      ],
      "artifact": "final_flow_map.json",
      "input_brief": "generation_brief",
      "allowed_references": [],
      "write_scope": [
        "final_flow_map.json"
      ],
      "status": "pending",
      "contract": [
        "return density, subdivision, accents, rests, held vowels, breath, voice, and switches",
        "mark pocket unverified without audio"
      ]
    },
    {
      "id": "audit",
      "role": "professional_auditor",
      "depends_on": [
        "draft",
        "flow_remap"
      ],
      "artifact": "audit.json",
      "input_brief": "generation_brief",
      "allowed_references": [],
      "write_scope": [
        "audit.json"
      ],
      "status": "pending",
      "contract": [
        "audit independently and cite bar-level evidence",
        "apply hard gates and label audio-dependent claims unknown"
      ]
    },
    {
      "id": "repair",
      "role": "repair_owner",
      "depends_on": [
        "audit",
        "draft",
        "narrative",
        "vocabulary",
        "humor",
        "rhyme",